{
  "adapter": {
    "consumer_repo": "/Volumes/Work/Work/index",
    "id": "ssi.short-post",
    "mechanism": "Consumer-side publish command for SPIKE short posts in index monorepo",
    "next_commands": [
      "Emit publish packet from ABVX-OS.",
      "Run index publish-post command in dry-run mode.",
      "Run npm run typecheck in /Volumes/Work/Work/index.",
      "Run npm run build in /Volumes/Work/Work/index if dry-run reports a structural exception.",
      "Commit and deploy the SSI tenant through existing index release flow only after human approval."
    ],
    "operation_id": "index.publish-post",
    "publish_strategy": "consumer_command",
    "target": "scripts/publish-post.mjs --surface ssi",
    "target_surface": "ssi"
  },
  "artifact_refs": [
    "content/publish-packets/content-ops-002-ssi-fast-path.json"
  ],
  "consumer_operation": {
    "apply_command": "cd /Volumes/Work/Work/index && node scripts/publish-post.mjs --surface ssi --packet <packet> --write",
    "dry_run_command": "cd /Volumes/Work/Work/index && node scripts/publish-post.mjs --surface ssi --packet <packet> --dry-run",
    "id": "index.publish-post",
    "target_surface": "ssi"
  },
  "enrichment": {
    "author": "Anton BV",
    "canonical_path": "/en/blog/placeholder-ssi-fast-path-validation",
    "cortex": null,
    "date_modified": "2026-08-10",
    "date_published": "2026-08-10",
    "hreflang": {
      "en": "/en/blog/placeholder-ssi-fast-path-validation"
    },
    "indexability": "INDEXABLE",
    "internal_link_suggestions": [],
    "machine_summary": "Dry-run only placeholder for SSI fast-path validation.",
    "meta_description": "Dry-run only placeholder for SSI fast-path validation.",
    "open_graph": {
      "description": "Dry-run only placeholder for SSI fast-path validation.",
      "image": null,
      "image_alt": null,
      "title": "Placeholder SSI post for deterministic fast-path validation"
    },
    "primary_entities": [
      "SSI",
      "placeholder",
      "dry-run",
      "Placeholder SSI",
      "Dummy SSI",
      "This",
      "It"
    ],
    "primary_source_links": [
      "internal:dummy"
    ],
    "publisher": "SPIKE Spot Index",
    "related_projects": [],
    "seo_title": "Placeholder SSI post for deterministic fast-path validation",
    "sitemap_state": "INDEXABLE",
    "slug": "placeholder-ssi-fast-path-validation",
    "social_preview": {
      "description": "Dry-run only placeholder for SSI fast-path validation.",
      "image": null,
      "image_alt": null,
      "title": "Placeholder SSI post for deterministic fast-path validation"
    },
    "structured_data": {
      "status": "SUPPORTED",
      "type": "BlogPosting"
    },
    "tags": [
      "SSI",
      "placeholder",
      "dry-run"
    ],
    "topics": [
      "validation",
      "publishing fast path"
    ],
    "warnings": []
  },
  "history": [
    {
      "action": "PREPARE",
      "actor": "abvx-content-ops",
      "result": "PREPARED",
      "timestamp": "2026-08-10T08:55:15Z"
    },
    {
      "action": "APPROVE",
      "actor": "owner",
      "result": "APPROVED",
      "timestamp": "2026-08-10T08:55:53Z"
    },
    {
      "action": "PUBLISH",
      "actor": "abvx-content-ops",
      "result": "PUBLISH_PACKET_EMITTED",
      "timestamp": "2026-08-10T08:55:53Z"
    }
  ],
  "human_gate": {
    "approved_at": "2026-08-10T08:55:53Z",
    "approved_by": "owner",
    "required": true,
    "state": "APPROVED"
  },
  "id": "content-ops-002-ssi-fast-path",
  "kind": "post",
  "locales": [
    "en"
  ],
  "payload": {
    "asset_refs": [],
    "author": "Anton BV",
    "body_lines": [
      "This is synthetic placeholder copy for validating the SSI publishing fast path.",
      "It is intentionally non-editorial and does not represent a real public post."
    ],
    "cover_image": null,
    "excerpt": "Dry-run only placeholder for SSI fast-path validation.",
    "image_alt": null,
    "media_event_candidate": null,
    "publisher": "SPIKE Spot Index",
    "source_refs": [
      "internal:dummy"
    ],
    "tags": [
      "SSI",
      "placeholder",
      "dry-run"
    ],
    "topics": [
      "validation",
      "publishing fast path"
    ]
  },
  "project": "ssi",
  "provenance": {
    "observed_at": "2026-08-10T00:00:00Z",
    "recorded_by": "CONTENT-OPS-002",
    "source_uri": null
  },
  "publication": {
    "event_ref": "events/projects/ssi/content_published-placeholder-ssi-fast-path-validation.json",
    "evidence_ref": "evidence/content-ops/content-ops-002-ssi-fast-path.publish.evidence.json",
    "mode": "REPORT_ONLY_HANDOFF",
    "packet_ref": "content/publish-packets/content-ops-002-ssi-fast-path.json",
    "published_at": "2026-08-10T08:55:53Z",
    "result": "CONDITIONAL_PASS"
  },
  "schema_version": "v1",
  "slug": "placeholder-ssi-fast-path-validation",
  "status": "PUBLISH_PACKET_EMITTED",
  "summary": "Dummy SSI publication fixture used only to prove the dry-run short-post fast path and enrichment package.",
  "surface": "short-post",
  "title": "Placeholder SSI post for deterministic fast-path validation",
  "validation": {
    "blockers": [],
    "checks": [
      "consumer dry-run report",
      "npm run typecheck"
    ],
    "exception_flags": {},
    "tier": "QUICK",
    "warnings": [
      "Fast path is deterministic but still human-gated.",
      "ABVX-OS does not write directly into index internals."
    ]
  }
}
