{
  "adapter": {
    "consumer_repo": "/Volumes/Work/Work/ABVXsite",
    "id": "abvx.writing",
    "mechanism": "Consumer-side publish command for native ABVX writing inside the existing /writing surface",
    "next_commands": [
      "Emit publish packet from ABVX-OS.",
      "Run ABVXsite publish-writing command in dry-run mode.",
      "Run npm run content:validate in /Volumes/Work/Work/ABVXsite.",
      "Run npm run build in /Volumes/Work/Work/ABVXsite if a structural exception is reported.",
      "Commit and deploy through the existing ABVXsite release flow only after human approval."
    ],
    "operation_id": "abvx.publish-writing",
    "publish_strategy": "consumer_command",
    "target": "scripts/publish-writing.mjs plus /writing and /writing/[slug]",
    "target_surface": "abvx.writing"
  },
  "artifact_refs": [
    "content/publish-packets/content-publish-004-abvx-personal-blog-finally.json"
  ],
  "consumer_operation": {
    "apply_command": "cd /Volumes/Work/Work/ABVXsite && node scripts/publish-writing.mjs --packet <packet> --write",
    "dry_run_command": "cd /Volumes/Work/Work/ABVXsite && node scripts/publish-writing.mjs --packet <packet> --dry-run",
    "id": "abvx.publish-writing",
    "target_surface": "abvx.writing"
  },
  "enrichment": {
    "author": "Anton BV",
    "canonical_path": "/writing/a-personal-blog-finally",
    "cortex": null,
    "date_modified": "2026-08-10",
    "date_published": "2026-08-10",
    "hreflang": {
      "en": "/writing/a-personal-blog-finally"
    },
    "indexability": "INDEXABLE",
    "internal_link_suggestions": [
      "/books",
      "/about",
      "/writing"
    ],
    "machine_summary": "A place for the things that do not fit into professional feeds.",
    "meta_description": "A place for the things that do not fit into professional feeds.",
    "open_graph": {
      "description": "A place for the things that do not fit into professional feeds.",
      "image": null,
      "image_alt": null,
      "title": "A Personal Blog, Finally"
    },
    "primary_entities": [
      "Anton Biletskyi-Volokh",
      "ABVX",
      "Medium",
      "Substack",
      "Nantes",
      "France"
    ],
    "primary_source_links": [
      "owner:approved-prompt"
    ],
    "publisher": "ABVX",
    "related_projects": [
      "books",
      "about",
      "writing"
    ],
    "seo_title": "A Personal Blog, Finally",
    "sitemap_state": "INDEXABLE",
    "slug": "a-personal-blog-finally",
    "social_preview": {
      "description": "A place for the things that do not fit into professional feeds.",
      "image": null,
      "image_alt": null,
      "title": "A Personal Blog, Finally"
    },
    "structured_data": {
      "status": "SUPPORTED",
      "type": "Article"
    },
    "tags": [
      "personal",
      "notes",
      "life"
    ],
    "topics": [
      "personal writing",
      "native site notes",
      "books and life"
    ],
    "warnings": []
  },
  "history": [
    {
      "action": "PREPARE",
      "actor": "abvx-content-ops",
      "result": "PREPARED",
      "timestamp": "2026-08-10T13:06:03Z"
    },
    {
      "action": "APPROVE",
      "actor": "owner",
      "result": "APPROVED",
      "timestamp": "2026-08-10T13:06:11Z"
    },
    {
      "action": "PUBLISH",
      "actor": "abvx-content-ops",
      "result": "PUBLISH_PACKET_EMITTED",
      "timestamp": "2026-08-10T13:06:19Z"
    }
  ],
  "human_gate": {
    "approved_at": "2026-08-10T13:06:11Z",
    "approved_by": "owner",
    "required": true,
    "state": "APPROVED"
  },
  "id": "content-publish-004-abvx-personal-blog-finally",
  "kind": "note",
  "locales": [
    "en"
  ],
  "payload": {
    "asset_refs": [],
    "author": "Anton BV",
    "body_lines": [
      "This is my personal website. My name is Anton Biletskyi-Volokh.",
      "For a long time, this site has mainly carried my professional writing from Medium and Substack: applied AI, the creative economy, systems, tools, and related things.",
      "I still write about them. They are an important part of my work.",
      "But they are not my whole life.",
      "I also write books that have nothing to do with AI. Some are fiction. Some are my translations of fiction. You can find them in the books section of this site.",
      "But a book card does not explain how a book came to exist. It does not say why I wrote it, translated it, abandoned it for a while, or came back to it later.",
      "There is more outside work, too.",
      "I have a family and children. I visit museums, exhibitions, strange concepts, and places that are hard to classify. I collect small discoveries that do not belong in a professional newsletter.",
      "I am also an actively exhibiting artist.",
      "So where should I write about all this?",
      "Facebook and Instagram used to be personal places for me. Much of my audience there is Ukrainian: some people are still in Ukraine, while others, like me, now live in many different countries.",
      "I live in Nantes, France.",
      "Over time, I stopped posting much in those personal social networks.",
      "LinkedIn is professional by design. Medium and Substack are also built around a subject, an audience, and a format.",
      "This blog is for the rest.",
      "There are no likes, dislikes, or comments here.",
      "I will write what I want, in the form I want.",
      "You are welcome to read it, or not read it.",
      "These are notes for other people, perhaps. But first of all, they are notes for me.",
      "I may write about a book, a museum visit, a family trip, something I cooked, a painting, an idea that did not become a project, or an object I found somewhere in Nantes.",
      "I may also write a shopping list so I do not forget it at the supermarket.",
      "For example:",
      "- Brut cider \u2014 1 bottle\n- Chilled croque-monsieur \u2014 2\n- Pork nems \u2014 2 packs\n- Sweet-and-sour gherkins \u2014 1 jar\n- Soy sauce \u2014 1 bottle\n- Eggs \u2014 1 dozen",
      "That is enough of a manifesto for now."
    ],
    "cover_image": null,
    "date_published": "2026-08-10",
    "entities": [
      "Anton Biletskyi-Volokh",
      "ABVX",
      "Medium",
      "Substack",
      "Nantes",
      "France"
    ],
    "excerpt": "A place for the things that do not fit into professional feeds.",
    "image_alt": null,
    "internal_link_candidates": [
      "/books",
      "/about",
      "/writing"
    ],
    "language": "English",
    "media_event_candidate": null,
    "publisher": "ABVX",
    "related_projects": [
      "books",
      "about",
      "writing"
    ],
    "seo_title": "A Personal Blog, Finally",
    "social_description": "A place for the things that do not fit into professional feeds.",
    "source_refs": [
      "owner:approved-prompt"
    ],
    "tags": [
      "personal",
      "notes",
      "life"
    ],
    "topics": [
      "personal writing",
      "native site notes",
      "books and life"
    ]
  },
  "project": "abvxsite",
  "provenance": {
    "observed_at": "2026-08-10T00:00:00Z",
    "recorded_by": "CONTENT-PUBLISH-004",
    "source_uri": null
  },
  "publication": {
    "event_ref": "events/projects/abvxsite/content_published-a-personal-blog-finally.json",
    "evidence_ref": "evidence/content-ops/content-publish-004-abvx-personal-blog-finally.publish.evidence.json",
    "mode": "REPORT_ONLY_HANDOFF",
    "packet_ref": "content/publish-packets/content-publish-004-abvx-personal-blog-finally.json",
    "published_at": "2026-08-10T13:06:19Z",
    "result": "CONDITIONAL_PASS"
  },
  "schema_version": "v1",
  "slug": "a-personal-blog-finally",
  "status": "PUBLISH_PACKET_EMITTED",
  "summary": "A place for the things that do not fit into professional feeds.",
  "surface": "writing",
  "title": "A Personal Blog, Finally",
  "validation": {
    "blockers": [],
    "checks": [
      "consumer dry-run report",
      "npm run content:validate"
    ],
    "exception_flags": {},
    "tier": "QUICK",
    "warnings": [
      "Routine native writing publication remains body-author-controlled.",
      "Quick tier is valid only while consumer dry-run and content validation both stay green."
    ]
  }
}
